{
  "$schema": "https://json-schema.org/draft/2020-12/schema",
  "$id": "status.schema.json",
  "title": "Mission Control status feed",
  "description": "Single data file behind Mission Control by Tapwise, schema v1. See references/schema.md.",
  "type": "object",
  "required": ["schema_version", "generated_at", "team", "panels", "roster", "routines", "deploys", "log"],
  "additionalProperties": false,
  "$defs": {
    "date": { "type": "string", "pattern": "^\\d{4}-\\d{2}-\\d{2}$" },
    "dateOrDateTime": { "type": "string", "pattern": "^\\d{4}-\\d{2}-\\d{2}(T\\d{2}:\\d{2}(:\\d{2}(\\.\\d+)?)?(Z|[+-]\\d{2}:\\d{2}))?$" },
    "hm": { "type": "string", "pattern": "^([01]\\d|2[0-3]):[0-5]\\d$" },
    "id": { "type": "string", "pattern": "^[a-z0-9][a-z0-9-]*$" },
    "panel": {
      "type": "object",
      "required": ["source", "as_of"],
      "additionalProperties": false,
      "properties": {
        "source": { "enum": ["LIVE", "SNAPSHOT", "DEMO"] },
        "as_of": { "oneOf": [{ "$ref": "#/$defs/dateOrDateTime" }, { "type": "null" }] },
        "note": { "type": "string" }
      },
      "allOf": [
        { "if": { "properties": { "source": { "enum": ["SNAPSHOT", "DEMO"] } } }, "then": { "properties": { "as_of": { "$ref": "#/$defs/dateOrDateTime" } } } }
      ]
    }
  },
  "properties": {
    "schema_version": { "const": 1 },
    "generated_at": { "$ref": "#/$defs/dateOrDateTime" },
    "generated_by": { "type": "string" },
    "team": {
      "type": "object",
      "required": ["name", "timezone", "team_formed"],
      "additionalProperties": false,
      "properties": {
        "name": { "type": "string" },
        "subtitle": { "type": "string" },
        "timezone": { "type": "string", "description": "IANA zone, e.g. Europe/Paris" },
        "team_formed": { "$ref": "#/$defs/dateOrDateTime" },
        "team_formed_basis": { "type": "string" }
      }
    },
    "panels": {
      "type": "object",
      "required": ["met", "clocks", "roster_count", "next_routine", "feed", "roster", "routines", "deploys", "log"],
      "additionalProperties": false,
      "properties": {
        "met": { "$ref": "#/$defs/panel" },
        "clocks": { "$ref": "#/$defs/panel" },
        "roster_count": { "$ref": "#/$defs/panel" },
        "next_routine": { "$ref": "#/$defs/panel" },
        "feed": { "$ref": "#/$defs/panel" },
        "roster": { "$ref": "#/$defs/panel" },
        "routines": { "$ref": "#/$defs/panel" },
        "deploys": { "$ref": "#/$defs/panel" },
        "log": { "$ref": "#/$defs/panel" },
        "org": { "$ref": "#/$defs/panel" }
      }
    },
    "roster": {
      "type": "array",
      "items": {
        "type": "object",
        "required": ["id", "name", "role", "status"],
        "additionalProperties": false,
        "properties": {
          "id": { "$ref": "#/$defs/id" },
          "name": { "type": "string" },
          "role": { "type": "string" },
          "hub": { "type": "boolean" },
          "status": { "enum": ["active", "standby", "online", "paused", "offline", "unknown"] },
          "mission": { "type": ["string", "null"] }
        }
      }
    },
    "routines": {
      "type": "array",
      "items": {
        "type": "object",
        "required": ["id", "name", "schedule"],
        "additionalProperties": false,
        "properties": {
          "id": { "$ref": "#/$defs/id" },
          "name": { "type": "string" },
          "owner": { "oneOf": [{ "$ref": "#/$defs/id" }, { "type": "null" }] },
          "timezone": { "type": "string" },
          "schedule": {
            "type": "object",
            "required": ["kind"],
            "additionalProperties": false,
            "properties": {
              "kind": { "enum": ["daily", "weekly", "once", "yearly"] },
              "time": { "oneOf": [{ "$ref": "#/$defs/hm" }, { "type": "null" }] },
              "weekdays": { "type": "array", "minItems": 1, "items": { "enum": ["mon", "tue", "wed", "thu", "fri", "sat", "sun"] } },
              "date": { "$ref": "#/$defs/date" },
              "month_day": { "type": "string", "pattern": "^(0[1-9]|1[0-2])-(0[1-9]|[12]\\d|3[01])$" }
            },
            "allOf": [
              { "if": { "properties": { "kind": { "const": "daily" } } }, "then": { "required": ["time"] } },
              { "if": { "properties": { "kind": { "const": "weekly" } } }, "then": { "required": ["time", "weekdays"] } },
              { "if": { "properties": { "kind": { "const": "once" } } }, "then": { "required": ["date"] } },
              { "if": { "properties": { "kind": { "const": "yearly" } } }, "then": { "required": ["month_day"] } }
            ]
          }
        }
      }
    },
    "deploys": {
      "type": "array",
      "items": {
        "type": "object",
        "required": ["id", "name", "platform", "status"],
        "additionalProperties": false,
        "properties": {
          "id": { "$ref": "#/$defs/id" },
          "name": { "type": "string" },
          "platform": { "enum": ["pages", "worker", "other"] },
          "url": { "oneOf": [{ "type": "string", "pattern": "^https://" }, { "type": "null" }] },
          "status": { "enum": ["deployed", "pending", "failed", "retired", "unknown"] },
          "last_deploy": { "oneOf": [{ "$ref": "#/$defs/dateOrDateTime" }, { "type": "null" }] },
          "note": { "type": "string" }
        }
      }
    },
    "log": {
      "type": "array",
      "items": {
        "type": "object",
        "required": ["date", "tag", "text"],
        "additionalProperties": false,
        "properties": {
          "date": { "$ref": "#/$defs/date" },
          "time": { "oneOf": [{ "$ref": "#/$defs/hm" }, { "type": "null" }] },
          "tag": { "enum": ["info", "deploy", "build", "milestone", "cancel", "alert"] },
          "bot": { "oneOf": [{ "$ref": "#/$defs/id" }, { "type": "null" }] },
          "text": { "type": "string", "maxLength": 120 }
        }
      }
    },
    "org": {
      "type": "object",
      "required": ["root", "groups", "nodes"],
      "additionalProperties": false,
      "properties": {
        "root": {
          "type": "object",
          "required": ["id", "name"],
          "additionalProperties": false,
          "properties": {
            "id": { "$ref": "#/$defs/id" },
            "name": { "type": "string" },
            "title": { "type": "string" },
            "remit": { "type": "string" },
            "anti_jobs": { "type": "array", "items": { "type": "string" } }
          }
        },
        "hub": { "$ref": "#/$defs/id" },
        "groups": {
          "type": "array",
          "items": {
            "type": "object",
            "required": ["id", "name", "members"],
            "additionalProperties": false,
            "properties": {
              "id": { "$ref": "#/$defs/id" },
              "name": { "type": "string" },
              "members": { "type": "array", "items": { "$ref": "#/$defs/id" } }
            }
          }
        },
        "nodes": {
          "type": "array",
          "items": {
            "type": "object",
            "required": ["id", "remit", "anti_jobs"],
            "additionalProperties": false,
            "properties": {
              "id": { "$ref": "#/$defs/id" },
              "remit": { "type": ["string", "null"] },
              "anti_jobs": { "type": "array", "items": { "type": "string" } }
            }
          }
        }
      }
    }
  }
}
